eng,source,ltl
continue; be happening; be in progress; undergo; maintain; keep; stay; _progressive_; SBJ {maintainer} makes OBJ hold true for some time,epo <to continue> [to continue],tokjoninues
be stable; be sustainable,POSSIBILITY OF continue,tokjoninuespis
be unstable; be unsustainable,ANTONYM OF be stable,tokjoninuespis
repeat; do again; return to; SBJ makes OBJ happen multiple times,epo <ripeti> [riˈpetas],lipetas
reverse; do back; return from; SBJ makes OBJ happen and then happen in reverse,REVERSAL OF repeat,lipetas
be possible; can; might; may; _possibility_; OBJ {possibility} can happen,jav <bisa> [bisa],pis
enable; SBJ makes OBJ become possible,INCOHATIVE OF be possible,piskes
prevent; SBJ makes OBJ stop being possible,CESSATIVE OF be possible,piskes
"try; attempt; will; intend; attempt; do for; do so; do in order to; SBJ {purposeful; intentful} makes OBJ {means} happen in order to make IND {purpose; reason; goal; end; intention; beneficiary} happen,hin <razón> [raˈson],ason
want; desire; hunger; hope; have an appetite; OBJ {hoper; wanter; desirous; hungry} wants IND {desire; wish; hope} to happen""",cmn <试试> [ʂɨ˥˩ʂɨ˥˩],cic
need; require; must; be necessary; suffice; be enough; OBJ {requisite; requirement} must be true in order for IND to be true,sot <hloka> [ɬokʼɑ],lok
be unacceptable; be too much; be insufficient; IND cannot be true if OBJ is true,ANTONYM OF need,lok
*should; be fit; be good; OBJ should happen to make IND {value function; goal} be true,epo <devus> [ˈdevus],tewus
should not; be bad; be unwise; OBJ {problem} should not happen to make IND be true,ANTONYM OF should,tewus
*must; have to; be responsible; be obligated; OBJ is obligated to make IND {obligation; duty; responsibility; rule},spa <debe> [ˈdeβe],tep
assign; obligate; SBJ {assigner} makes OBJ responsible for IND happening,INCOHATIVE OF must,tepkes
beI forbidden; beI against the rules; beI illegal; OBJ is not allowed to make IND {banned; prohibited} happen,OPPOSITE OF must,tep
forbid; pass rules against; SBJ {authority} forbids OBJ from making IND happen,INCOHATIVE OF be forbidden,tepkes
be more; exceed; be positive; be greater; be enough; be too much; OBJ is numerically greater than IND {zero; reference} {AMOUNT:numerical value; positiveness {GENITIVE:numerical; cardinal}},spa <Más> [ˈmas],mas
be less; be negative; be not enough; be too little; OBJ is numerically less than IND,ANTONYM OF be more,mas
increase; SBJ {increaser} makes OBJ increase relative to IND,INCOHATIVE OF be more,maskes
decrease; SBJ {decreaser} makes OBJ decrease relative to IND,CESSATIVE OF be more,maskes
be number; be in *order; be -th; index; OBJ {item; element} has a late position in IND {list; order; sequence; queue; line} {AMOUNT:position; index; number {GENITIVE:ordinal}},epo <ordo> [ˈordo],hot
be number from the end; be in order from the end; negatively index; OBJ has an early position in IND {AMOUNT:position from end; negative index; number from end},ANTONYM OF be number,hot
move down; position; sort; SBJ {sorter} moves OBJ down the sequence IND {sorted} {METHOD:order},INCOHATIVE OF be number,hotkes
move up; position; SBJ moves OBJ up the sequence IND,CESSATIVE OF be number,hotkes
say; convey; SBJ {sayer} conveys IND {message; idea; signal; utterance} to OBJ {addressee} {INSTRUMENT:phone; cell phone; communicator; communication device|METHOD:language; protocol {GENITIVE:linguistic; lingual}},cmn <说> [ʂwɔ˥],cwos
perceive; sense; beI perceptible; can see; can hear; can feel; can smell; can taste; OBJ {perceiver; observer} can perceive IND {perception; experience} {INSTRUMENT:sense; sensor|GENITIVE:perceptual},ben <বোঝা> [bod͡ʑ̤a],poc
show; look; listen; sniff; taste; read; SBJ {shower; looker; listener} shows IND {show} to OBJ,INCOHATIVE OF perceive,pockes
obscure; hide; remove; SBJ makes OBJ stop perceiving IND {obscured},CESSATIVE OF perceive,pockes
can see; see; view; OBJ {seer} sees IND {image; picture; sight; view} {GENITIVE:visual; optic},ben <দেখ> [d̪ekʰ],tek
show; look; SBJ shows IND {show; visualisation} to OBJ visually,INCOHATIVE OF can see,tekkes
hide; remove from view; SBJ makes OBJ stop seeing IND,CESSATIVE OF can see,tekkes
be sighted; OBJ is sighted,POSSIBILITY OF can see,tekpis
be blind; OBJ is blind,ANTONYM OF be sighted,tekpis
sighten; restore sight; SBJ causes OBJ to become sighted,INCOHATIVE OF be sighted,tekpiskes
blind; SBJ {blinding} causes OBJ to become blind,CESSATIVE OF be sighted,tekpiskes
can hear; hear; OBJ hears IND {sound; audio} {GENITIVE:auditory; acoustic},cmn <听> [tʰiŋ˥],tik
listen; SBJ shows IND to OBJ audially,INCOHATIVE OF can hear,tikkes
mute; SBJ makes OBJ stop hearing IND,CESSATIVE OF can hear,tikkes
have hearing; OBJ has hearing {INSTRUMENT:hearing aid},POSSIBILITY OF can hear,tikpis
be deaf; OBJ is deaf,ANTONYM OF have hearing,tikpis
hearify; restore hearing; SBJ makes OBJ able to hear,INCOHATIVE OF have hearing,tikpiskes
deafen; SBJ {deafening} causes OBJ to become deaf,CESSATIVE OF have hearing,tikpiskes
can smell; smell; OBJ smells IND {scent; odor; aroma; smell} {GENITIVE:olfactory},ibo <ísì> [ísì],his
waft; sniff; smell; show aromatically; SBJ makes OBJ start smelling IND,INCOHATIVE OF can smell,hiskes
smother; suppress odor; SBJ makes OBJ stop smelling IND,CESSATIVE OF can smell,hiskes
can taste; taste; OBJ tastes IND {taste; flavour} {GENITIVE:gustatory},msa <rasa> [rasa],las
sample; show taste; SBJ makes OBJ start tasting IND,INCOHATIVE OF can taste,laskes
obscure taste; SBJ makes OBJ stop tasting IND,CESSATIVE OF can taste,laskes
can feel; feel; touch; OBJ can feel IND {GENITIVE:tactile; tactual},epo <senti> [ˈsentas],senas
show tactually; SBJ shows IND to OBJ tactually,INCOHATIVE OF can feel,senaskes
hide tactually; SBJ makes OBJ stop feeling IND,CESSATIVE OF can feel,senaskes
read; load; interpret; SBJ {reader} reads OBJ {file; text; reading; passage; data; note} from the physical state of IND {source},spa <leer> [leˈer],les
write; record; type; mark; save; SBJ {writer} encodes OBJ {writing; data} physically on IND {record} {INSTRUMENT:writing utensil|LOCATION:desk; writing surface|GENITIVE:literary; scriptural|METHOD:script; writing system; encoding},yor <lati> [lati],lat
erase; overwrite; obscure; SBJ {eraser} removes traces of OBJ {erased} from IND {INSTRUMENT:eraser},REVERSAL OF write,lat
speak; voice; say out loud; SBJ says IND {quote; words; phrase; utterance; speech} to OBJ out loud {TIME:speech|INSTRUMENT:voice|GENITIVE:vocal; locutory},ben <বলতে> [bɔl̪ɔt̪e],polot
be tangible; be physical; be objective; OBJ {object; thing} is tangible,pan <ਠੋਸ> [ʈʰos],tos
be abstract; be intangible; be nonphysical; OBJ {concept} is abstract,ANTONYM OF be tangible,tos
print; tangiblise; soidify; SBJ {printer} brings OBJ into the physical realm,INCOHATIVE OF be tangible,toskes
scan; abstract; intangiblise; SBJ {scanner abstracter} takes OBJ out of the physical realm,CESSATIVE OF be tangible,toskes
hold; carry; have on one's person; OBJ {holder} holds IND {held; accessory},ben <রাখা> [rakʰa],lak
pick up; hand; grab; SBJ {hander; picker upper} puts IND in OBJ's hand,INCOHATIVE OF hold,lakkes
put down; release; SBJ {putter downer; taker} takes IND out of OBJ's hand,CESSATIVE OF hold,lakkes
own; have; possess; belong; OBJ {owner} owns IND {property},hin <मालिक> [maːlik],malik
give; receive; obtain; get; transfer ownership; SBJ {giver} gives IND {gift; given} to OBJ {receiver; obtainer},INCOHATIVE OF own,malikkes
take; lose; give away; renounce ownership; SBJ {taker} takes IND {theft; prize; taken} from OBJ {loser},CESSATIVE OF own,malikkes
keep; retain ownership; SBJ lets OBJ {keeper; hoarder} keep IND {kept},PROGRESSIVE OF own,maliktokjoninues
accompany; come with; be together; _accompanitive_; OBJ {accompaniment; companion; mate; partner; company} accompanies SBJ {accompanied},cmn <陪> [pʰeɪ̯˧˥],pejs
be between; be among; OBJ exists in the space encompassed by the elements of IND {bounds},hin <बीच> [biːt͡ʃ],pic
put between; place among; SBJ puts OBJ among IND,INCOHATIVE OF be between,pickes
remove from between; pull from; take out of; SBJ removes OBJ from among IND,CESSATIVE OF be between,pickes
be stacked; be layered; OBJ {layer} is stacked on IND {book; stack},ibo <tụba> [tʊba],tup
stack; layer; SBJ {stacker} stacks OBJ onto IND,INCOHATIVE OF be stacked,tupkes
unstack; unlayer; SBJ {unstacker} unstacks OBJ from IND,CESSATIVE OF be stacked,tupkes
"be sure; beI probable; beI likely; OBJ is likely to happen according to IND; see ""believe"" and ""think"" {AMOUNT:Bayesian probability}",epo <certe> [ˈt͡serte],set
be skeptical; beI improbable; beI unlikely; Bayesian improbability; IND is unlikely to happen according to OBJ {skeptic},ANTONYM OF be sure,set
convince; become sure; SBJ provides new information that leads OBJ to come to find IND probable,INCOHATIVE OF be sure,setkes
unconvince; become skeptical; SBJ provides new information that leads IND comes to beI OBJ improbable,CESSATIVE OF be sure,setkes
"believe; seem; OBJ {believer} accepts that IND {seeming} is true on a subconcious level; see ""be sure"" and ""think""",yor <gbàgbọ> [ɡ͡bàɡ͡bɔ],pap
"think; appear; OBJ {thinker; accepter} conciously decides that IND {apparent} is true; see ""be sure"" and ""believe""",cmn <思考> [sɯ˥kʰɑʊ̯˧˩˧],sukaws
recall; remind; remember; jog memory; SBJ {mnemonic} helps OBJ {recaller} recall IND {factoid; datum} from memory,epo <memori> [meˈmoras],memolas
can remember; know; OBJ {knowledgable; smart} has IND stored in memory,POSSIBILITY OF recall,memolaspis
memorize; drill; remind; SBJ {driller; crammer; memorizer} makes OBJ memorize IND,INCOHATIVE OF can remember,memolaspiskes
forget; erase memory; SBJ {mind-eraser} makes OBJ forget IND,CESSATIVE OF can remember,memolaspiskes
understand; comprehend; beI sensical; know; be smart; OBJ {understander} understands IND {understood} well {AMOUNT:level of understanding},ben <বুঝতে> [bud͡ʑ̤t̪e],puc
misunderstand; be confused; beI cryptic; OBJ does not understand IND {misunderstood} well,ANTONYM OF understand,puc
explain; SBJ {teacher} teaches OBJ {student} to understand IND,INCOHATIVE OF understand,puckes
confuse; unlearn; SBJ {confuser} makes OBJ stop understanding IND,CESSATIVE OF understand,puckes
"know; be informed; OBJ {knower; smart} remembers IND {knowledge}, believes and thinks it to be true, and correctly understands why it is true",spa <saber> [saˈβer],sapes
teach; learn; study; beI out; SBJ {teacher; professor; master} teaches IND to OBJ {student; learner} {LOCATION:school; college; university|TIME:lesson; education},INCOHATIVE OF know,sapeskes
unteach; unlearn; SBJ {unteacher} makes IND {unlearner} unlearn what they thought they knew about OBJ,CESSATIVE OF know,sapeskes
be *familiar with; IND {familiar to; accquaintance; famous; notorious} is familiar to OBJ,cmn <熟> [ʂu˧˥],cus
be unfamiliar with; be strange; be foreign; IND {unfamiliar to; stranger} is unfamiliar to OBJ,ANTONYM OF be familiar with,cus
familiarise; SBJ {familiariser} makes OBJ become familiar with IND,INCOHATIVE OF be familiar with,cuskes
unfamiliarise; SBJ {unfamiliariser} makes OBJ become unfamiliar with IND,CESSATIVE OF be familiar with,cuskes
be friendly; be nice; be kind; OBJ considers IND {friend} a friend {AMOUNT:friendliness; amity},epo <amika> [aˈmika],hamik
be hostile; be mean; be harsh; OBJ is hostile toward IND {enemy; infamous},ANTONYM OF be friendly,hamik
befriend; introduce; soften; SBJ {friend-arranger} makes OBJ become friends with IND,INCOHATIVE OF be friendly,hamikkes
drive apart; aggravate; SBJ {enemy-maker} makes OBJ become hostile toward IND,CESSATIVE OF be friendly,hamikkes
love; be infatuated; OBJ {lover} is in love with IND {love} {TIME:romance},spa <amar> [aˈmar],hamas
set up; fall in love; introduce; infatuate; SBJ {matchmaker; cupid} makes OBJ fall in love with IND,sho <kuisa> [kuisa],kuis
relate; OBJ {relatee} is genetically related to IND {relative; kin; blood},sot <pheta> [pʰetʼɑ],pet
like; be *good; favour; be appealing; be pleasing; be beautiful; be delicious; be positive; OBJ {liker; optimist; -phile} likes IND {preference; favourite} {AMOUNT:goodness; preference level|LOCATION:heaven},cmn <好> [xɑʊ̯˧˩˧],haws
dislike; be bad; disfavour; be unappealing; be displeasing; be ugly; be gross; be negative; OBJ {pessimist; -phobe} dislikes IND {anathema; least favourite} {LOCATION:hell},ANTONYM OF like,haws
improve; defend; argue for; SBJ {improver} raises OBJ's opinion of IND,INCOHATIVE OF like,hawskes
worsen; insult; argue against; SBJ {worsener} lowers OBJ's opinion of IND,CESSATIVE OF like,hawskes
be old; OBJ {elder; senior; adult; grown-up} is old {AMOUNT:age},cmn <旧> [t͡ɕjoʊ̯˥˩],cjows
be young; OBJ {kid; girl; boy} is young,ANTONYM OF be old,cjows
age; olden; SBJ {ager; Father Time} makes OBJ get older,INCOHATIVE OF be old,cjowskes
age backward; youngen; SBJ {youngener} makes OBJ get younger,CESSATIVE OF be old,cjowskes
be late; be after; be tardy; positive time; OBJ {future} happens after IND {AMOUNT:time; time interval; duration},hin <देर> [der],tet
be early; be before; be timely; negative time; OBJ {past} happens before IND,ANTONYM OF be late,tet
laten; delay; postpone; travel forward through time; SBJ {postponer} pushes OBJ forward through time,INCOHATIVE OF be late,tetkes
pass; advance; travel back in time; SBJ {time machine} causes OBJ {passing; present} to become before IND,CESSATIVE OF be late,tetkes
be big; be large; be spacious; OBJ has a high volume {AMOUNT:size; volume},cmn <大> [ta˥˩],tas
be small; be little; OBJ has a low volume,ANTONYM OF be big,tas
grow; expand; dilate; SBJ {grower} grows OBJ {balloon},INCOHATIVE OF be big,taskes
shrink; contract; constrict; SBJ {shrinker} shrinks OBJ,CESSATIVE OF be big,taskes
be long; be tall; OBJ (protrusion; length) is long {AMOUNT:length; maximum physical dimension; length of time},cmn <长> [ʈ͡ʂɑŋ˧˩˧],cak
be short; OBJ {nub; knob} is short,ANTONYM OF be long,cak
lengthen; grow; SBJ {lengthener} lengthens OBJ,INCOHATIVE OF be long,cakkes
shorten; shrink; SBJ {shortener} shortens OBJ,CESSATIVE OF be long,cakkes
be broad; OBJ {ribbon; blade} is broad {AMOUNT:breadth; middle dimension},eng <broad> [bɹʷɔːd],pwot
be narrow; OBJ is narrow,ANTONYM OF be broad,pwot
broaden; SBJ {broadener} broadens OBJ,INCOHATIVE OF be broad,pwotkes
narrow; SBJ {narrower} narrows OBJ,CESSATIVE OF be broad,pwotkes
be thick; OBJ {slab} is thick {AMOUNT:thickness; minimum dimension},mar <जाड> [d͡ʑaːɖ],cat
be thin; OBJ {film} is thin,ANTONYM OF be thick,cat
thicken; SBJ {thickener} thickens OBJ,INCOHATIVE OF be thick,catkes
thin; SBJ {thinner} thins OBJ,CESSATIVE OF be thick,catkes
be far; be distant; be beyond; be not at all; OBJ is physically or numerically far from IND {AMOUNT:distance},spa <lejos> [ˈlexos],lehos
be near; be close; be before; be approximately; be almost; be like; OBJ is physically or numerically close to IND,ANTONYM OF be far,lehos
distance; move away; separate; SBJ {separator} distances OBJ from IND,INCOHATIVE OF be far,lehoskes
approach; move toward; meet; draw close; put together; SBJ {joiner} moves OBJ toward IND {TIME:meeting},CESSATIVE OF be far,lehoskes
keep apart; separate; divide; SBJ {wall; barrier} separates OBJ {other side} from IND,PROGRESSIVE OF be far,lehostokjoninues
be in front; be forward; be between; OBJ {field of view} has a positive _y_ coordinate from IND's point of view {AMOUNT:_y_ coordinate},fil <harap> [haɾap],halap
be behind; be backward; OBJ {back} has a negative _y_ coordinate from IND's point of view,ANTONYM OF be in front,halap
advance; move forward; SBJ {advancer} makes OBJ move forward from IND's point of view,INCOHATIVE OF be in front,halapkes
retreat; move backward; SBJ {retreater} makes OBJ move backward from IND's point of view,CESSATIVE OF be in front,halapkes
follow; trail; SBJ makes OBJ {follower; tail} follow IND {followed},PROGRESSIVE OF be behind,halaptokjoninues
be right; OBJ {right side} has a positive _x_ coordinate from IND's point of view {AMOUNT:_z_ coordinate},spa <derecho> [deˈɾet͡ʃo],telec
be left; OBJ {left side} has a negative _x_ coordinate from IND's point of view,ANTONYM OF be right,telec
move right; SBJ makes OBJ move right from IND's point of view,INCOHATIVE OF be right,teleckes
move left; SBJ makes OBJ move left from IND's point of view,CESSATIVE OF be right,teleckes
be wide; be obtuse; be big; be large; OBJ {splotch; blotch} spans a wide angle from the point of view of IND {AMOUNT:angle;angular size},epo <larĝa> [ˈlard͡ʒa],lac
be narrow; be acute; be small; be little; OBJ {dot; point} spans a narrow angle from the point of view of IND {edge; blade; corner},ANTONYM OF be wide,lac
widen; grow; spread out; dilate; SBJ makes OBJ span a wider angle from the point of view of IND,INCOHATIVE OF be wide,lackes
narrow; shrink; contract; SBJ makes OBJ span a smaller angle from the point of view of IND,CESSATIVE OF be wide,lackes
be below; be down; SBJ {header; top} appears below OBJ from the point of view of IND {AMOUNT:altitude angle; distance down page},epo <sube> [ˈsube],sup
be above; be up; SBJ {footer; bottom} appears below OBJ from the point of view of IND,ANTONYM OF be below,sup
sink; SBJ {lowerer} makes OBJ appear to move down from the point of view of IND,INCOHATIVE OF be below,supkes
raise; rise; SBJ {raiser} makes OBJ appear to move up from the point of view of IND,CESSATIVE OF be below,supkes
be starboard; be right; OBJ appears on IND's right {AMOUNT:bearing; azimuth angle; distance across page},hin <दाहिना> [daːɦinaː],tahik
be port; be left; OBJ appears on IND's left,ANTONYM OF be starboard,tahik
move starboard; move right; SBJ moves OBJ to IND's right,INCOHATIVE OF be starboard,tahikkes
move port; move left; SBJ moves OBJ to IND's left,CESSATIVE OF be starboard,tahikkes
be counterclockwise; be widdershins; OBJ appears rotated counterclockwise from the orientation IND {original orientation; right-side up} from the point of view of IND {AMOUNT:orientation; rotation},pan <ਖੱਬੇ> [kʰəːbe],kap
be clockwise; OBJ appears rotated clockwise from the orientation OBJ from the point of view of IND,ANTONYM OF be counterclockwise,kap
rotate counterclockwise; SBJ {counterclockwise turner} turns OBJ counterclockwise from IND's point of view,INCOHATIVE OF be counterclockwise,kapkes
rotate clockwise; SBJ {clockwise turner} turns OBJ clockwise from IND's point of view,CESSATIVE OF be counterclockwise,kapkes
be low; be under; OBJ {bottom; depths; ground; earth; hell; underlayer} has a lower altitude than IND {standard altitude; usually sea level} {AMOUNT:lowness; deelevation; altitude; layer},cmn <低> [ti˥],tis
be high; be over; OBJ {top; heights; heaven; sky; cosmos} has a higher altitude than IND,ANTONYM OF be low,tis
lower; SBJ {lowerer} decreases OBJ's altitude relative to IND,INCOHATIVE OF be low,tiskes
heighten; SBJ {raiser} increases OBJ's altitude relative to IND,CESSATIVE OF be low,tiskes
be south; OBJ has a lower latitude than IND {standard parallel; usually the North Pole} {AMOUNT:latitude},epo <sude> [ˈsude],sut
be north; OBJ has a higher latitude than IND,ANTONYM OF be south,sut
move south; SBJ decreases the latitude of OBJ relative to IND,INCOHATIVE OF be south,sutkes
move north; SBJ increases the latitude of OBJ relative to IND,CESSATIVE OF be south,sutkes
be east; OBJ has a higher longitude than IND {standard meridian; prime meridian} {AMOUNT:longitude},cmn <东> [tʊ̯ŋ˥],tuk
be west; OBJ has a lower longitude than IND,ANTONYM OF be east,tuk
move east; SBJ increases the longitude of OBJ relative to IND,INCOHATIVE OF be east,tukkes
move west; SBJ decreases the longitude of OBJ relative to IND,CESSATIVE OF be east,tukkes
be dense; be frequent; be common; be tightly packed; be fine; OBJ occurs frequently and close together,spa <denso> [ˈdenso],tes
be sparse; be infrequent; be uncommon; be loosely distributed; be coarse; OBJ is few and far between,ANTONYM OF be dense,tes
gather; collect; densify; SBJ increases the spacial frequency of OBJ,INCOHATIVE OF be dense,teskes
spread out; separate; SBJ decreases the spacial frequency of OBJ,CESSATIVE OF be dense,teskes
face; point; OBJ {direction} is oriented in the direction toward IND {target; front},ben <মুখে> [mukʰe],muk
turn; face; rotate; point; SBJ {pointer} makes OBJ {turner} turn toward IND,INCOHATIVE OF face,mukkes
turn away; avert; SBJ makes OBJ turn away from IND,CESSATIVE OF face,mukkes
"be moral; be right; be good; if OBJ {good deed; moral} happens, it will be morally good {AMOUNT:morality; goodness}",hin <नैतिक> [næːtik],natik
"be evil; be immoral; be wrong; be bad; if OBJ {evil; sin} happens, it will be morally bad",ANTONYM OF be moral,natik
rectify; turn good; SBJ makes OBJ become moral,INCOHATIVE OF be moral,natikkes
wrong; turn evil; SBJ makes OBJ become evil,CESSATIVE OF be moral,natikkes
be skillful; be apt; be effective; be good; OBJ is good at causing IND {AMOUNT:skill level},epo <lerta> [ˈlerta],let
be inept; be unskillful; be ineffective; be bad; OBJ is bad at causing IND,ANTONYM OF be skillful,let
train; teach; SBJ {trainer} makes OBJ {trainee} become skillful at IND,INCOHATIVE OF be skillful,letkes
untrain; forget; become rusty; SBJ {untrainer} makes OBJ {rusty} become unskillful at IND,CESSATIVE OF be skillful,letkes
work; work hard; be productive; OBJ {worker} is working hard on IND {job; work} {LOCATION:workplace; workstation; office},ben <করতে> [kɔrɔt̪e],kolot
be unproductive; be lazy; OBJ is working little on IND {neglected},ANTONYM OF work,kolot
put to work; make productive; employ; SBJ makes OBJ start working on IND,INCOHATIVE OF work,kolotkes
retire; give up; make unproductive; fire; SBJ makes OBJ become unproductive at IND,CESSATIVE OF work,kolotkes
notice; be aware; OBJ {noticer} is conciously aware of the presence of IND {noticed},spa <notar> [noˈtar],notas
be oblivious; be unaware; OBJ fails to notice the presence of IND {inconspicuous; stealthy},ANTONYM OF notice,notas
call attention; point out; notice; SBJ {attention caller} calls OBJ's attention to IND,INCOHATIVE OF notice,notaskes
hide; obscure; SBJ {hider; obscurer} hides IND from OBJ,CESSATIVE OF notice,notaskes
mean; call; OBJ {name; signal; word} means IND {definition; meaning; denotation},eng <mean> [miːn],mik
define; name; SBJ {definer; dictionary; convention; protocol} declares that OBJ means IND,epo <difini> [diˈfinas],tifinas
be alive; be lively; OBJ {life; organism; living thing} is alive {AMOUNT:liveliness|TIME:life},cmn <活> [xwɔ˧˥],hwos
be dead; be unlively; OBJ {corpse} is dead {TIME:death},ANTONYM OF be alive,hwos
bring to life; come to life; SBJ brings OBJ to life,INCOHATIVE OF be alive,hwoskes
kill; murder; die; pass away; SBJ {killer; murderer} kills OBJ,CESSATIVE OF be alive,hwoskes
be turned on; be animate; be active; be open; OBJ is turned on,cmn <打开> [ta˧˩˧kʰaɪ̯˥],takajs
be turned off; be inanimate; be passive; be closed; OBJ is turned off,ANTONYM OF be turned on,takajs
turn on; go off; animate; activate; SBJ {activator} turns on OBJ,INCOHATIVE OF be turned on,takajskes
turn off; deactivate; kill; SBJ {deactivator} turns off OBJ,CESSATIVE OF be turned on,takajskes
save; rescue; sustain; SBJ {saver; life support} keeps OBJ from dying,PROGRESSIVE OF be alive,hwostokjoninues
convert; translate; transform; SBJ {converter; translator} conveys OBJ in the form IND {METHOD:transformation},eng <convert> [ˈkʰɑːnvəɹt],kanwat
wear; be clothed; OBJ wears IND {clothing; clothes; article},cmn <穿> [ʈ͡ʂʰwan˥],cwak
put on; dress; robe; SBJ {dresser} puts IND on OBJ {dressee},INCOHATIVE OF wear,cwakkes
take off; undress; disrobje; SBJ {undresser} takes IND off of OBJ {undressee},CESSATIVE OF wear,cwakkes
move; jostle; be energetic; be restless; OBJ is deforming and moving {AMOUNT:motion; energy},spa <mover> [moˈβer],mopes
be still; be unenergetic; OBJ is motionless in place,ANTONYM OF move,mopes
set off; set in motion; move; energise; SBJ {motor; mover} makes OBJ start moving,INCOHATIVE OF move,mopeskes
stop; still; settle; deenergise; SBJ {brake} makes OBJ stop moving,CESSATIVE OF move,mopeskes
be mobile; be movable; OBJ can move,POSSIBILITY OF move,mopespis
be stuck; stick; be immobile; OBJ {sticker} is stuck to IND,ANTONYM OF be mobile,mopespis
unstick; mobilise; extricate; SBJ makes OBJ stop being stuck to IND,INCOHATIVE OF be mobile,mopespiskes
stick to; demobilise; trap; SBJ sticks OBJ to IND,CESSATIVE OF be mobile,mopespiskes
spin; rotate; revolve; OBJ {spinning} is spinning,spa <girar> [xiˈɾar],hilas
walk; step; SBJ walks on OBJ {path; walk},cmn <走> [t͡soʊ̯˧˩˧],sows
run; SBJ runs on OBJ {treadmill},epo <kuri> [ˈkuras],kulas
fall; be falling; OBJ moves uncontrollably under gravitational forces {CAUSE:gravity},spa <caer> [kaˈer],kaes
drop; fall; SBJ {dropper} makes OBJ {dropped; fallen} start falling,INCOHATIVE OF fall,kaeskes
catch; fall on; land; stop; SBJ {catcher; landing} makes OBJ {caught} stop falling,CESSATIVE OF fall,kaeskes
be on; rest on; support; OBJ {at *rest; on top} is on IND {table; ground; floor; support},jav <ngaso> [ŋaso],nas
roll; be rolling; OBJ {wheel; roller} is rolling,spa <rodar> [roˈðar],lotas
start rolling; roll from; SBJ {roller} makes OBJ start rolling,INCOHATIVE OF roll,lotaskes
stop rolling; roll into; SBJ makes OBJ stop rolling,CESSATIVE OF roll,lotaskes
be inside; contain; be inner; be central; be in the middle; OBJ {indoors; room; content; center; middle; heart; bowels} is inside IND {container} {AMOUNT:innerness},cmn <内> [neɪ̯˥˩],nejs
be outside; be outer; be peripheral; OBJ {outdoors; edge; fringe} is outside of IND,ANTONYM OF be inside,nejs
enter; put in; SBJ moves OBJ into IND,INCOHATIVE OF be inside,nejskes
