"what; interrogative and relative",n
"one; no meaning",s
"me; first person; the speaker",wo,cmn wǒ
"you; second person; the listener",ni,cmn nǐ
"it; he; she; them; third person; a previously mentioned noun phrase",ta,cmn tā
"us; first person plural exclusive; the speaker and others",wota,cmn wǒ tā
"y'all; second person plural; the listener and others",nita,cmn nǐ tā
"us-here; first person dual inclusive; the speaker and the listener",woni,cmn wǒ nǐ
"us-all; first person plural inclusive; the speaker, the listener, and others",wonita,cmn wǒ nǐ tā
